Amazing,5.0,"Bought this as our last trip was a cluster of cords and chargers. These types of bags have come a long ways, suspected them to be poorly laid out but I was very impressed. We fit a large inverter power bar, tablet, all our cords, memory cards, and charging bricks in here with room to spare, Super cool!","May 18, 2018",Mikayla Fisher
Well Made,4.0,"A very well made bag, which holds a surprising amount of cords! I could have gone up one size to hold all my cords, but I still managed to fit it all into this smaller model....just a little tight. This is great for home cord storage and travel/business.","February 27, 2019",sdt1
Great Product...Not worth $25,3.0,"Great little bag. You will notice when it arrives this is worth about $10 at most. lots of great spots for all small cables and headphones. Mine has small usb brick for iphone, 4 charging cords, 2 earbuds, travel power adapter, 4000mah power bank, aux cord, ground loop isolator, pens, and usb flash drive.","December 10, 2018",Jay
Good quality but too small,4.0,"It's good quality, but turned out to be too small for my need. So I ordered a larger one from Amazon which is perfect. Should have realized I had more stuff than what this travel organizer can hold.","May 7, 2020",ecmisera
It’s a bag - stuff goes in it.,5.0,"I use this bag for holding all my laptop video cables, network cables, USB keys, chargers, external Disks and so on. Everything fits in and the compartmentalization is an awesome feature.","November 15, 2019",christian turner
a bit small,3.0,"It looks bigger on the picture. It's more on the small size. I still use it for storing my less necessary wires and batteries, but I expected it to be like an inch larger all around? Anyway, it's ok for it's intended purpose.","August 7, 2018",Paul Dupuis
This case is very compact and strong!!,5.0,"I bought this for work. I work in film and we are constantly taking continuity photos every day. This fits my Canon Selphy compact printer plus the charger, paper holder and extra paper....perfect to carry to set or for storing in the work trailer!","August 16, 2020",Linda T.
Don’t recommend,1.0,Feels like it will just bend and everything in it will break! Wouldn’t recommend for electronics and that’s what it is for....,"December 18, 2019",Brendan
This organizer is a good size for storing all your electronic pieces,5.0,"This organizer is a good size for storing all your electronic pieces, including a tablet. We haven't used it yet, but are looking forward to using this over our large zip lock bag solution from the previous trip!","April 4, 2018",Amazon Customer
Quite small,4.0,"The bag is MUCH smaller than their deceptive pictures make it look. Look carefully at the description for sizes. The quality of the bag is good, the shipping was quick, so those are positives. Overall I am feeling I received modest value for my dollar. =/","December 21, 2016",CanadaDan
Using it for small tools,4.0,"Truth be told I bought this to carry small electronics tools in, not for cables etc... But works great in both regards. Some of the stitching had created already but still holding up strong everywhere else.","November 24, 2018",Amazon Customer
Not entirely as expected,4.0,Great quality and durability Size is deceiving and pocket location makes bag bulky at the one end. Will likely buy smaller bag for short trips,"February 23, 2019",Troy Lohnes
Seems relatively durable. I should have gotten a bigger ...,4.0,"Seems relatively durable. I should have gotten a bigger size as this is very tight. Labels should be more generic as not everyone carries SD cards with them (I have more USB sticks for example). Other than that, it keeps stuff neat in one spot. Just what the doctor ordered.","February 16, 2018",Sam Stratigeas
Great bag for techno supplies and cords,5.0,"This bag is perfect size for traveling and also just to use around the house. It holds plenty of cords, adapters and extras and is well made with water proof type nylon material. I am planning to buy a couple more.","January 30, 2018",Highland Lass
Undeniable Organization Capabilities,5.0,This bag is amazing! It's so small yet so well laid out and compact. It provides a crazy amount of organization. Would definitely recommend this bag to anyone who travels regularly or works mobile or goes to school. Would be a rest organizer in a car or something like that as well. Awesome product.,"June 5, 2018",Tori
Functional and keeps you organized.,5.0,"Bought for my husband who is a professional camera man for all his little pieces, cords, and parts. He loves it. I wish there was a really big version like the size of a backpack, I’d buy that too!","July 1, 2019",J. L. Harper
It amazing how much this little bag can hold,5.0,"I work in event production and need to travel with a zillion little cables and adapters regularly, and this keeps them organized so I can find exactly what I'm looking for in seconds. It amazing how much this little bag can hold, and its made more than a few of my nerd friends jealous. Very satisfied.","February 2, 2018",Tinker & Rove
Fits everything,5.0,I was wondering if this would be big enough but was surprised at what it fit. I have not traveled with it yet so not positive about durability but to look and feel it seems good. It is going to take a beating because it will be in my motorcycle all the time,"April 1, 2019",Mark
HIGHLY RECOMMENDED,5.0,I bought this for an overseas trip. I could fit most of my accessories in the bag. It helps to have everything in one place and works as advertised. I will probably buy a bigger case so i can pack some larger components in a secure and convenient package.,"November 10, 2019",Shay M.
"Good value, lots of storage space",5.0,"This provides plenty of space for the cords, etc. that anyone needs. And, it takes up little space in luggage. A very useful purchase.","October 8, 2020",rappar
Wrong Shipment Corrected,5.0,"I received the wrong bag.  After my review I was contacted by Ellie at Ecosusi Inc and she corrected the order, I am very pleased with the bag and commend the customer service and the product is excellent.  The bag is built well and holds all the stuff I need for travel.  Thanks","September 4, 2018",Lloyd Cross
great compact bag,5.0,"Bought this for my daughter for Christmas. She is a bit of an organization freak and this unit was perfect. It will hold her smart phone, cables charging station and a small tablet(samsung 9 inch, would not suggest for anything larger) It is very compact with smart styling and it seems to be made out of durable fabric. Excellent purchase","December 27, 2018",Amazon Customer
You can do better,3.0,This is much smaller than anticipated and it is difficult to use the elastic straps . Hard to pack it effectively. The side panels bend when packed. It would be better if deeper and more rigid.,"October 16, 2020",Mike J
Great little organizer,5.0,It's a great bag for organizing. Holds a lot more than expected and keeps my cords in an orderly fashion in my computer bag. The bag is deep which is nice to hold a couple of chargers as well.,"August 5, 2019",Rich
Very organized.,4.0,"A little smaller then I expected but lots of slots, pockets and elastic straps to secure and store things. Should work just fine.","December 24, 2019",Nancy
"Love the case, lots of room!",5.0,"Love this case, it holds everything I have and more!!  My husband adds his stuff to my case when we travel together.  Talking Ipad mini, wireless speakers, battery charger, two kindles and lots of cables.","February 17, 2018",ASWhizbang
Great but not perfect.,4.0,"It’s a perfect little travel bag and does fit a lot of stuff. Only complaint is that actetically could be more visually pleasing. Also, it’s very bulky when loaded w stuff and doesn’t easily fit into luggage. It’s heavy.","October 3, 2018",Ryan Cook
Great size,5.0,Really like this bag. It’s big but not too big. Can fit all the chargers for my ipad pro and various tech. Love it.,"April 7, 2019",David T
"Étui comportant plusieurs compartiments, parfait pour les voyages.",5.0,Très belle étui que j’utilise pour mes voyages et qui conviens parfaitement à tous mes accessoires pour mon iPhone XR ainsi qu’à mon IPad Très bonne qualité et de parfaite grandeur. Je vous le recommande !!!!!,"December 27, 2019",Hugo Henry
Love it!,5.0,"I love this bag, we use it on long and short haul trips. It fits all the cables and keeps them organized. It fits an i pad mini or an ereader nicely as well as memory cards, cables etc.","October 15, 2019",B Andrews
I t has a good number of storage spaces,4.0,"Looks like it will be good to travel with, would be better with a shoulder strap has only had carry strap","December 29, 2019",Chuck
super,5.0,"grand espace et très facile pour ranger nombres de câbles.  le rangement pour la tablette est vraiment genial, avec le charger et le cable, on a tout sous la main,","March 21, 2018",Jo
"Didn't meet my needs, but was good.",2.0,"Should have known it would be quite flat. Wanted to get something to also put my GoPro Session in while backpacking. Great cord storage though, I liked how it was organized. Returned. Quick and easy refund.","February 26, 2018",S. Pateman
Nice product,5.0,"Nice bag to keep all electronics at the same place. I travel a lot and it's been very useful to have all my stuff in the same bag. Lots of room for cables, tablets, SD cards, external battery, etc.","April 30, 2019",Elie Moreault
Great Bag for all sorts of storage needs,5.0,"This bag is sturdy and amazing, now I will be honest, I don’t use it for the intended purpose. My toddler is a Type 1 Diabetic and when we are going to be away from home for a few days, the storage you can have in this bag, especially if you are still MDI is amazing!!!","January 29, 2018",Heather Fuchs
Love this bag,5.0,Lots of storage options and very versatile. My only complaint is the flap for the outside pockets is narrower than the pocket itself - it should at least be the same size so you know your devices are safe and free from accidental scratches/damage when travelling with it and other gear in the same bag.,"January 17, 2019",Kenn Crawford
"This is a very good product - well-made, good fit and finish.",5.0,"Great product. Soft, but well-made. Not as large as you would think but large enough to store ALL of my cables, wires, mouse, etc. No more loose tech junk cluttering my backpack... Thank you!","January 15, 2018",TJ SwimDad
Top Notch Quality,5.0,"Better than discribed.  Great quality hold lots and lots of gadgets, cables and power banks.  Great travel companion.","October 26, 2019",SensOfficeRalph
""
Product:,"WayinTop Electronics Component Fun Kit w/E-Book, Upgraded Electronic Starter Kit with Breadboard Jumper Wires Kit, PCB Soldering Kit, LEDs & Resisitor Kit for Arduino/Raspberry pi/ESP32/ESP8266"
URL:,https://www.amazon.ca/WayinTop-Electronics-Electronic-Breadboard-Resistance/dp/B07Z1BK7NG/ref=sr_1_14?dchild=1&keywords=electronics&qid=1606075994&sr=8-14
Price:,27.99
Overall Rating:,4.5 out of 5 stars
Reviews:
Title,Rating,Review,Date,Author
The breadboard holes are misaligned,1.0,"As you can clearly see from the image I attached, most of the breadboard holes are misaligned, you'd have to force-push components to barely get them in...and you risk bending them (like shown in the image). I don't have issues with the other components of the kit, but the breadboard is terrible.","August 1, 2020",Uzziah
Le rapport qualité  prix.,5.0,Liste au complet produit et qualité  prix acceptable . Merci,"June 27, 2020",SOMESSI Basile
,,"You have to email the company for a PDF file to get the instructions.  The packaging is ridiculous.  Talk about cramming 10 pounds of crap in a 5 pound bag.  Not to mention when I was opening the box the kit fell from my coffee table to a shag carpet floor and the plastic case shattered like I dropped a Christmas ornament on a concrete floor.  That was a freaking mess.  I had to go buy a little parts case from the hardware store.  So add another $7 to the kit right there. The whole thing is geared toward Arduino learning, but it doesn't come with and Arduino board and the AD on Amazon doesn't really tell you that it doesn't come with an Arduino Board.  Maybe it does tell you, but I do not have 3 hours to research an electronics learning tool.  I personally didn't learn that the whole thing was worthless without the Arduino board until I placed the order and finally received the PDF file.  It also requires an uncommon USB cable to power it up.  I am sure there is a reason for that, but they don't provide the cable or any adapters so you are on a search for an uncommon cable that you have to BUY or rig one up yourself (which is what I did with 2 old cell phone chargers).  I had to cut 2 cords off the cell phone chargers and splice them together.  Sorry Wayin Top, but I do not recommend your product.  Not to mention the shipment got lost in the mail.  I finally got it about 2 weeks after the original delivery date promised. Buy a kit with the Arduino board and instructions included.  This one has been nothing but delay after delay. I had to wait for: Wait for the shipment.  Wait for the PDF email with the instructions (that's freaking ridiculous).  Search for an uncommon power cord or make your own.  Wait for that to come in if you buy it.  Search for an Arduino board.  Pay and wait for the Arduino board.  Who knows what else I will have to search and wait for.  100% disappointed.  This was a gift for my son's birthday.  he is interested in RC, robotics, and drone technology.  The shipment missed his birthday and it wouldn't have mattered anyway because we had no power supply or instructions when it finally did show up.","Reviewed in the United States on May 5, 2020",Christopher IXer
,,"This kit includes a lot of essential components for a low price, but there is a noticeable lack of quality. A few examples: - Some of the jumpers have leftover injection molded pieces hanging on near the ends, so you have to snip those off or else they will get in the way. The jumpers are also quite thin, so thin that my cat chomped one in half with one bite. - The breadboard terminals are often difficult to get connected. Some of them are loose and your wires will accidentally slip out, some are very stiff and you have to use a lot of force to get it to snap in (sometimes bending your component in the process). - The resistors are poorly labelled and the striping system used to determine how many Ohms it has is not the typical system. Besides these issues, it works OK and I like the little box it comes with to keep everything together. The difficulty of the breadboard is really annoying though, so that's the main reason I'm only giving it 3 stars.","Reviewed in the United States on June 18, 2020",Cat
,,So far so good. A good beginner electronics set with a lot of options for electronic projects. Main thing that would make it better would be a dual male USB cable for USB power.,"Reviewed in the United States on November 19, 2019",Shannon Parker
,,Bought it for my kid's school project and it helped a lot. She was able to test the circuit at home. The kit has all the basic components which are used in STEM school's projects. We had  great fun. Only wished that it had few sample circuit diagrams which we could use as reference. Overall i would recommend it to every STEM school kid,"Reviewed in the United States on February 2, 2020",Sandeep Khare
,,its got almost everything I need for my Arduino fun except I do wish it had come with Mosfits but it doesn't matter 5 stars!  oh and if you want the instructions you can download it right here on this page  under Technical Specifications,"Reviewed in the United States on August 29, 2020",Robert James Guerra
,,"This item is good for its value, it includes almost everything, all of it work as I am aware of. For any beginners, make sure you put a resistor to the positive from a LED light because it can decrease the life span of it. It is a good value as well, it is quite cheap for including almost everything, one of the good products I bought.","Reviewed in the United States on March 6, 2020",jonathan pecany
,,"I was looking for a set of items for my new robot/raspberry project. I came across this set with everything I needed. This set comes in a nice box, very well organized and labeled, specially resistors. I haven't test everything but so far so good.","Reviewed in the United States on January 26, 2020",Hedwing Zabala
,,Almost everything you could want to get your feet wet. Everything worked as needed and the scoreboard project using the leds and photo resistors. Good Product. Would buy from vendor for other parts. Thanks,"Reviewed in the United States on February 22, 2020",Belinda
,,Just as described,"Reviewed in the United States on October 14, 2020",T. Davis
,,Everything works as expected.,"Reviewed in the United States on December 7, 2019",Maltonomy
,,The kit has multiple high quality components. Every single component functioned fine. Would definitely recommend.,"Reviewed in the United States on August 25, 2020",Ann Potter
,,"""I bought this kit in June 11 ., can you send me the E-book link please ? My email is silvia_urodrigu"" in Amazon.com Help.","Reviewed in the United States on June 19, 2020",Silvia Rodriguez
,,This component pack had everything I wanted for the price and a little extra.,"Reviewed in the United States on August 4, 2020",Nicholas Delong
,,HUGE assortment of everything you need to get started with Arduino at an amazing price!,"Reviewed in the United States on January 6, 2020",Vincent R. Mercer
,,The kit was exactly what my Son was looking for.,"Reviewed in the United States on February 7, 2020",Brian Johnston
,,Great options,"Reviewed in the United States on February 11, 2020",koda lewis
""
Product:,"iSpring ED2000 Whole House Electronic Descaler Water Conditioner, Alternative Water Softener"
URL:,https://www.amazon.ca/iSpring-ED2000-Electronic-Descaler-Conditioner/dp/B0744TC3PW/ref=sr_1_15?dchild=1&keywords=electronics&qid=1606075994&sr=8-15
Price:,206.99
Overall Rating:,4.0 out of 5 stars
Reviews:
Title,Rating,Review,Date,Author
Tested 1 year then removec,3.0,"Product arrived quickly and was easy to install. Now been five or six weeks since installation. My well water hardness is 21 grains. There has been some improvement. Water feels softer in shower. Rate of hard water scale is diminished, however still getting lime scale build up in electrical kettle. Not as fast as before, but still need to use vinegar to clean it. Manufacturer says to wait three months for full effect. For an inexpensive descaler it seems ok, time will tell. I suspect water that is less hard than mine responds better to the unit. I may still go out and purchase a water softener..... UPDATE Aug 17 2020. I have removed this unit after over a year of service. I really can't see any difference. My hardness ranges between 17 and 21.","November 1, 2019",Bob M
Easy To Install,5.0,I got this because of build up in my coffee maker once I install it still waiting for coffee to ask me to clean it been 2 months. Works great!!!!,"September 27, 2019",Boots89
Enlève complètement le calcaire dans votre eau,5.0,"Wouw ça marche tout de suite, plus de calcaire dans notre eau. Nos appareils finissent de se nettoyer tranquillement. On aurait dû faire ça depuis très longtemps. Je le qualifi de simple et très efficace. Mon époux à eu des pierres aux reins et le médecin disait qu c'était souvent à cause du calcaire dans l'eau.","August 31, 2020",Johanne
Very effective at removing scale,5.0,"Very effective in removing scale build-up from pipes.  It does take about 6 months to see the full effect but initially, you may notice a black scale occasionally coming out of the faucets.  You may need to occasionally remove the aerators and turn the faucet on full to let the black scale drain out so the aerators don't become clogged.  I have seen an increase in flow and pressure.  The water is more pleasant and soap lathers more readily.","November 19, 2019",Amazon Customer
Eh. Only so so,2.0,"At first it seemed to be working, but maybe that was just in my head. I will have to try moving it and reinstalling it another way to see if anything will improve it","January 3, 2019",Trevor T
Not sure.,2.0,Not sure if it’s working. Still hard to clean hard water stains.,"January 13, 2019",Richard
Fantastic product,5.0,"I noticed an immediate difference  in my water.  More suds, no more scale.  Just fine powder which wipes away easily.  pre-existing scale broke up and dissipated.  I also added an iSpring whole house filter to remove small particulate matter and my water is now excellent.  I no longer have to de-scale my espresso machine.","October 25, 2020",Picky Pete
Product has given this woman wonderful soft hair,5.0,Noticed a difference with the water within a week or two.  The hard water has in the past left me with dry coarse hair.  Now I am happy to say my hair (which has been coloured for 30 years) is soft and manageable.  Product is easy to install and no more scale in the kettle.,"August 14, 2019",Patti
does it work ?,2.0,"its been 2 + weeks ... i'm thinking does this thing work ?  no evidence it does, kettle still scaling up.","December 13, 2018",michael whitehead
"i got it today looks like junk, inside its just a 18vac resistors nothing special. waste of money.",1.0,"i got it today looks like junk, inside its just a 18vac resistors nothing special. waste of money.","May 13, 2020",Andrew Macdonald
Makes a difference,5.0,"We've had it for over a month and I can feel a difference on how the water affects my skin (eczema), my husband said it was easy to install, great price too thank you!","August 6, 2018",mveeMtl
must be close to a plug in .,5.0,"easy install , and works almost instantly , can notice the difference in the water.","August 8, 2019",walter pshyk
"Works as expected, after a month i feel a ...",5.0,"Works as expected, after a month i feel a difference in the water and the scaling is starting to clear up.","September 5, 2018",Mark Michael Vejvoda
do not buy,1.0,"waste of money, been using it for almost a year now and did not see any improvements.","November 12, 2019",Roush
works as advertised,5.0,for sure helps with hard water kids get lots of bubbles in there bath now,"October 30, 2020",Gillian F.
Don’t bother,1.0,"Waste of money, did nothing, I should have returned it. Absolutely no help at all.","September 6, 2020",Stephen S.
Simple installation!,4.0,"I’ll know more in few months,I think it’s working great!","February 14, 2020",carlos soares
Good solution for hard water build up,4.0,Bought this for my guest cabin. Was easy to install and I do see a difference in the white mineral water deposits on the shower and sinks after just a week of installation.,"October 14, 2020",Amazon Customer
Functionality,5.0,Easy to install Unit has been in place for about two weeks. Jury is still out on its effectiveness,"September 3, 2020",Warm feelings
eficaciter,5.0,ca fait pres dune semaine installer et vois dega dimunition de calcaire o robinet tres sastifait et commander 1 autre pour voisin,"November 8, 2020",Amazon Customer
Too soon to tell,4.0,Easy to install,"August 6, 2019",johnny chesluck
Works very well.,5.0,"Installed it a month ago, I can feel the different now. Soap foaming easier, the scale in my kettle is gone too. Works better than my expectation.","December 8, 2018",Steven
Efficace,4.0,Ça fais 1 mois qu’il est installée. On voit bien  la différence jusqu’à présent. Beaucoup moins de dépôt calcaire et leau,"October 14, 2020",Melodie
Un bon complément  pour l eau dur !,4.0,Tres sastisfaite jai vu une difference avec l' eau !,"July 24, 2020",Alexina
Load of Horse manure,2.0,"My spidey senses told me this was a gimmick and I should have known better, don't waste your cash","July 28, 2020",Big Jimmy
Great value,5.0,Works great!  I was skeptical at first but it does work.,"September 26, 2020",Nasreldin M.
"If you understand the device, it is well worth it.",5.0,Works as expected.,"May 30, 2020",Kindle Customer
bon produit,5.0,pour adoucir l’eau,"September 26, 2020",Nancy
Q,5.0,Replaced salt softener,"June 28, 2019",Amazon Customer
The best in the west,5.0,Works,"January 23, 2019",Tdebakke
,,Muy buen producto me gusto,"Reviewed in Mexico on August 6, 2020",Arturo Rubi
,,"Measured hardness professionally  before installing. It was 210 - very hard. Will come back to this feedback every week to see changes and report. For tight spaces you have to know the length of the coil before installation. On 3/4"" pipe it's 4.25"". Also you don't know if you can cross red and blue wires as they come out of the box because in my setup water flow is from right to left. So my box is facing wall not to cross them. In seven days hardness dropped to 160 ppm. Will be coming back to this once a week to tell what changed. Second week brought hardness to 140 ppm. Manual is saying though that unit ""will not affect hardness measured by traditional test"" and with this type of water conditioner the results can be measured by observing changes in scale forming areas. So I'll report any changes as I see them. In three weeks it's 130 ppm.It looks like the ball on the bottom of my electrical kettle is still shiny, I had to clean it monthly with vinegar or baking soda.","Reviewed in the United States on January 15, 2018",Tester
