Product:,"Ricoh 910725 Theta V camera, Metallic Gray"
URL:,https://www.amazon.ca/Ricoh-Theta-camera-Metallic-Gray/dp/B074W5BKYS/ref=sr_1_1_sspa?dchild=1&keywords=electronics&qid=1606075994&sr=8-1-spons&psc=1&spLa=ZW5jcnlwdGVkUXVhbGlmaWVyPUEzS0gzVkdONUtPNldWJmVuY3J5cHRlZElkPUEwMTUwNDQ1MTZNWjZMNzc3MjIyTCZlbmNyeXB0ZWRBZElkPUEwOTAzODIwMlk1WDNGVDhGSFhESCZ3aWRnZXROYW1lPXNwX2F0ZiZhY3Rpb249Y2xpY2tSZWRpcmVjdCZkb05vdExvZ0NsaWNrPXRydWU=
Price:,439.00
Overall Rating:,4.4 out of 5 stars
Reviews:
Title,Rating,Review,Date,Author
"Huge improvements over the previous Theta, but the V still has some huge limitations that affect its performance",3.0,"I almost bought Ricoh's previous version of the Theta about a year ago, but where I felt it fell short was the picture quality. Fast-forward to the release of this new 4K version and I knew it was something I needed to at least try. As a preface to my review, I'm a professional photographer and videographer and I also instruct both subjects, so there were lots of ideas and potential uses I had for this device. First, let me start off by highlighting the GOOD things about the Theta V, because unfortunately in my opinion there are far fewer positive things than negative when it comes to this little doodad: - The physical design and footprint of the device is good - it's relatively small and unobtrusive which makes it totally viable for recording a small or private event without being in the way. It does have LEDs when it's on and recording, but in my opinion they are not distracting which is also a good thing. - It's easy to use - when the app connects properly, it's quite simple and straightforward to use. I say when because in my experience with the Theta I've had a lot of connectivity issues in terms of my phone dropping the connection to the camera, even when I'm standing right next to it...but I'll talk more about that when I get to the cons below. - The software is also easy to use - when it comes to importing and converting your files to be compatible in a 360 space, it's as simple and dragging and dropping the original file into the window, selecting where you want the converted file to be saved, and that's pretty much it. There are a couple of other options available as well: one lets you downsample the quality from 4K to HD, and the other lets you choose whether you want the stitching software to ""fix"" the top and bottom of the file...all in all, it's quite easy to use which I was really happy about since sometimes the software you need to operate special camera equipment can be more difficult to figure out than the equipment itself. - The standard tripod mount on the bottom of the Theta makes it compatible with just about any tripod and makes it mountable just about anywhere, and it can also be used handheld, so it's very versatile in that regard. - The battery life seems fairly on-par with the limited internal memory - I'm listing this as a pro because the battery did last long enough for me to record the footage I needed, but if your plan is to use it professionally you may find that both the internal storage and battery life are limiting. - The flat bottom - I'm really glad they made the bottom flat so that you can just stand it up on a flat surface. There might only be specific situations where you could or would want to use it like that, but I'm glad it's at least possible. - One thing I like about the app is that you can view the camera feed output in stitched or unstitched view which is sometimes helpful to be able to switch back and forth so easily. Okay, now onto the BAD things about the Theta V...here we go: - One of the biggest and most frustrating issues with the Theta V, as I see it, is that you lose access to live view through the app while you are recording. So when the camera is setup but not recording, you can see what the camera sees inside the app (in stitched or unstitched view). But as soon as you start recording, live view is no longer available inside the app until you stop recording. I understand that they maybe couldn't have programmed it to have live view while filming, but all I'm saying is that it is a major downside to not be able to see what you're capturing as you're capturing it. This was a huge strike against the Theta V for me. - Due to the file format and how the 360 video files need to be converted before they can work properly in a 360 space, I could not seem to play any of my recordings back through the app. I know you can configure the camera to work as a remote to watch live playback on a television, but frankly this feature is pretty useless in a lot of (most) situations since how often are you going to have access to a TV for playback? Maybe there is a way to watch your recordings in the app, but I couldn't not figure out how. Again, it's a small inconvenience but when you stack it on top of all the other small inconveniences, well...you'll see what my verdict is. - No expandable storage OR exchangeable batteries - if the first two cons I listed weren't dealbreakers for you, this one very well could be. You are limited not only by the internal storage of 19GB (which is not much, especially when it comes to 4K video) but you're also limited to its built-in battery. No, you cannot expand the memory with a MicroSD card once the internal memory is full. No, you cannot purchase extra batteries to be able to continue using the camera after the internal battery dies. In my opinion, these types of limitations are pretty inexcusable in 2017. Even if these were the only two things that they ""fix"" for the next version of the Theta, it would be an immensely more useful device. - Another con is that there are visible stitch lines in certain weather and/or certain lighting situations. Obviously the stitching can't be perfect, so if you're expecting it to be, you're likely going to be disappointed. The way they stitch the videos together is quite good in my opinion and certainly usable, but again, just don't expect it to look perfect. - In my experience, even the picture quality on this 4K Theta seems a little poor. Based on my comparisons with footage shot with the previous version of the Theta the quality is certainly much better, but when you compare it to footage shot with an actual 4K camera it definitely doesn't measure up. Which is to be expected because the thing only costs $500...I would expect a $1,000+ DSLR to produce better quality so this isn't really a surprise, but it was a little disappointing nonetheless that the quality wasn't still a little better than it is. - I do like that Ricoh included a soft pouch for carrying the Theta V, but for the price it would have been nice if they could have also included a simple hardshell case with a soft inner material to protect the lenses. - I've already mentioned the fact that you can't buy extra batteries, but another thing worth mentioning is the battery life. I know I listed it as a pro because for me personally the battery lasted long enough, but like I said above, if you plan on using it professionally I expect that you will feel very limited by the life of the internal battery. - Poor connectivity - in my experience with the Theta V, the wifi range is extremely poor especially outdoors. My phone would drop the connection to the camera if I was moving around, and even when I was standing just a few feet away from the Theta it would still disconnect and none of the app features would work until I reconnected the wifi connection. Again, this is just another inconvenience that, when paired with the rest of them, makes for a frustrating user experience a lot of the time. If the wifi connection wasn't such garbage and you could start/stop recording from a number of feet away (like you should be able to) then it would be so much better. - As easy as the software is to use, it's still kind of a pain that you need special software to convert or play these videos. I understand that is just the nature of the beast of 360 videos, but it's still a con as far as I'm concerned. - Price. Obviously I have no idea what it costs to design or manufacture a device like this, but based on my use and experience with it, I would say that a price tag of around $300-400 would seem much more reasonable, especially given its limitations. In my opinion $500+ is a lot of money to spend on this item which is certainly neat but has some serious and restrictive shortcomings. - In my experience it is ideal to use mounted on a stationary tripod. Not only is the 360 video a bit hard to watch if the camera is also in motion, but the stitching from the software that removes the Theta from the frame becomes really noticeable and weird-looking when the pixels around it are moving. - Very poor dynamic range, especially in low light - I wouldn't expect the low-light performance of any $500 camera to be great, but even with that being said it is quite awful. The dynamic range is much better when there's lots of available light, but if you're shooting in an area that's even slightly dim you will lose almost all of the detail in any dark or shadowy part of the frame. - I would have liked the ability to rotate a recording within the app whether before or after filming. For example, so you could hold the Theta upside down in order to get an extremely low angle. Perhaps this is a feature and I just didn't see it, but I don't think it's possible and I think that a rotation option would make it a lot more versatile. - The total remaining recording time left on your internal memory is hidden in the live view settings - I'm listing this is a con because I think this information should absolutely be displayed on the main app/live view screen, not buried in a menu somewhere. When you're limited to 19GB of internal memory, it becomes extremely important to manage your space and I think that would be much easier if the remaining memory was always visible within the app, just like the battery meter. All in all, the Theta V is a really neat and interesting piece of equipment that does a relatively good job of recording 360 video and audio in a fairly simple way. However, it has some pretty significant limitations that make it impossible for me to be able to justify keeping it. I think that if Ricoh addresses some of these problems for the next version of the Theta, it could be a truly wonderful device that would absolutely have a spot in my camera bag. But for now it feels like something that is almost there but just not quite enough to be worth having at this point in time.","December 5, 2017",Chris P. Bacon
"Good dynamic range and companion apps, but disappointing build-quality",2.0,"As my 360 virtual tour business started taking off, I ""upgraded"" to this camera and though I really wanted to like it, I was very disappointed in the build-quality. The first unit I ordered had one of its lenses misaligned, making half the 360 image blurry, so I had to return it. But once I received the replacement unit and used it on the very first project, I found that it had the same exact problem as the first one. The attached photo, taken in good lighting conditions, illustrates the misalignment of one lens making the whole right-side of the spherical image blurry and as you can see the resolution is not that great either. The only reason I did not give a one-star rating is because of the good dynamic range and decent companion apps.","September 3, 2018",Kris Tarr
Not worth the price.,3.0,"I didn't expect the greatest but for $560 CAD, I expected more quality than what I'm getting. My 360 tours looked like I used a 2009 phone with 25 megapixels. The noise and chromatic abberation is pretty bad. However I need it for my job and the only affordable option for the platform I'm using. This is at most a $300-$400 camera.","May 15, 2020",VN
Not durable enough to absorb a 2 feet fall.,2.0,"Used this extensively in our European tour. It took very good 360 photos and videos. It fell flat on a cobbled stone road while on a slim tripod, the 2 lenses survived the impact but not the unit. It starts up for a few seconds then a beep and red light goes off then powers off. I am now sending to Ricoh service for a fix under warranty. Not a durable product and I am disappointed.","October 27, 2019",JP King
"Excellent, easy to use, but image quality - not the best",4.0,"Excellent for non-professional 3D photographers; Image is not as good as I expected.  Ricoh Theta Z1 is probably better to obtain higher image quality. However, it is Overpriced and it can be damaged easily (no protection anti-shock by design, so be extra-cateful!). Here it is my story: After using my new V camera less than 3 weeks, a powerful wind took it down with the tripod; I was lucky as the lens were not damaged. AND, again lucky to avoid a huge repair price provided by the service, and made it work again by myself (I have optoelectrinics background). So far, all works great, the only thing that bothers me is the image quality (obviously depends on the lens) I reccommend the device - it is a wonderful technological work in progress - well done and delightful!","September 21, 2020",Sanda Iordachescu
J'adore!,5.0,"J'ai acheter cette appareil pour mes voyages, puisque j'étais tannée de chercher des angles parfait ou des parametres parfaits pour prendre des photos. Je l'adore! Il capte le moment présent, la qualité est géniale et toutes mes photos sont toujours très apprécié par mon entourage!","December 29, 2019",Marie-Annick Cloutier
Cracked upon delivery,2.0,"The product was cracked open leaving a gap! I was able to snap it back together without any issues and looks good as new however, we had to return it because we weren't too sure about the quality especially when we witnessed it being broken the moment we received it. Its not the cheapest camera, sadly not the quality we were expecting.","November 21, 2018",Stephanie
Parfait pour visite 360 en immobilier,5.0,Je suis courtier immobilier je peu maintenant faire mes propres visites 360 La qualité d’image est très bien et ont peu toujours les améliorer aussi avec un logiciel. Garder en tête par contre que vous devez avoir un abonnement d’environ 450$/année pour avoir accès au lien 360 de vos montages. Avec le logiciel tours de Ricoh. Mais c est la même chose avec peu importe la caméra. Très facile de faire le Montage 360 directement avec votre téléphone. Bien satisfaite,"September 6, 2020",Dominique
Quality product. Quality images.,5.0,"I bought this for my husband. He loved it. Found it easy to use, and like the picture quality he was getting. Also seemed to have decent battery life. Another great feature is the option to purchase an underwater housing for it too. Being avid scuba divers, we look forward to trying it underwater on our next dive trip!","January 25, 2019",Lil_Chickita
Connaître les glitchs permet d'obtenir les meilleures photos,4.0,"Allez vous informer en ligne sur comment activer le balancement des blancs et des tonalités, car c'est avec ça que vous pourrez prendre les meilleures photos qui ne sont pas pixelisées. Les gens ici qui disent que l'image est pixelisée se sont simplement butées aux glitchs dans les paramètres de l'application. Une fois que j'ai su comment activier le hdr, configurer le balancement des blancs, iso etc c'est là que j'ai pris mes meilleures photos.","September 4, 2020",Amazon Customer
pricy but great!,5.0,"image quality is amazing. i’ve been using this for different purposes. i’m getting into 3d rendering and use the camera to create quick HDRIs which come out quite clean. I also have been dabbling in 360 streaming, which has been quite useful during this quarantine, allowing our friends and family who aren’t able to make it to some special events due to capacity restrictions to enjoy the day and observe the entire room.","September 14, 2020",Talha Tabish
Cheap components/housing. Very fragile.,1.0,"Unfortunately the product housing exploded after being tipped over on the tripoid. It didn't hit hard, but the bump was enough to explode the components.. Now it won't go back together properly. Very cheaply made for what it costs.","August 27, 2020",VancouverSean
Why...why buy this?,1.0,"I owned this for 4 hours which was 3 hours and 59 minutes too long. I was going to ya edit for work but it’s slow, cumbersome and really unnecessary. My phone does good enough. Maybe it’s my fault, maybe my expectations were to high.","October 1, 2018",Jed
Good,5.0,"Good camera, great videos and pictures, battery inside and no external card. Internal memory bad for that but good quality","December 27, 2018",Cristian Sanchez
it works,3.0,lot of money for the value it works but it is a hell of a job to get it figured out cool camera  lots of issue's but once ya figure it out ..its pretty cool,"April 28, 2019",Leonard Mabee
Ricoh Theta V Rocks,5.0,"Beautiful pictures and video coming from a novice. Unfortunately, it zaps battery when taking video","July 20, 2020",Joeadamxx
Works well,5.0,"Good resolution, easy to comnect. We used it for Google My Business listings and it worked great.","August 12, 2019",Joel Wiebe
Not bad,4.0,There are cheaper alternatives that do the job as well. Unless you're using it with a certain app where they only support Ricoh Theta check the Xiaomi alternatives,"January 7, 2019",Hammond
Great camera,5.0,"This is my second Ricoh 360 camera. The V replaces an earlier model, the SC. The V is much better. Faster transfer speed and image quality. But a quality low profile tripod while you're at it.","August 23, 2020",Rob Gurdebeke
As described  love this item,5.0,The item arrived on time and is as described it took a little while to get used to connecting,"April 2, 2019",Amazon Customer
Nicw,5.0,Nice camera but not that high resolution,"April 25, 2020",Su
Awesome quality photos,5.0,The quality of the photos is way better than expected. Takes full HD photo spheres and you can't tell where the seam is at all. Perfect for Real Estate photography.,"April 2, 2019",Joey
Works well,5.0,I do wish it took higher resolution photos but it is as described and the camera works well.,"November 25, 2018",Mark
Easy to use VR camera,5.0,This is a very cool device and takes great pictures easily.  It is simple to get them into a VR rig or onto Facebook as well.,"October 2, 2018",Eric H
Would buy another,5.0,Love the quality and how easy it is to use!,"July 16, 2019",CCDMA
very good,5.0,very good,"September 1, 2020",Elitsa
Good Camera,4.0,I've receive the package in time. Ricoh Theta V works very well with my Samsung Galaxy S6 Edge. I find the photos a little blurry but I need to test it more.,"June 4, 2018",Carl Servant
Love it!,5.0,Great shipping time. Great camera!,"May 23, 2020",Alison
compatibilité,5.0,Attention Caméra pour personne ayant un ordinateur assez récent sinon vous devez vous munir de complications au niveau des plugins,"September 15, 2018",martin laberge
Best 360 cameras,5.0,Best 360 cameras,"September 28, 2020",SeanIsraelson
Great little unit,4.0,"Great little unit. Resolution is a bit disappointing when zooming in on pics, but very useful on job sites.","January 29, 2018",Bruce G.
Poor image quality,2.0,Outdoor image quality is poor. Wish I got a better model.,"July 23, 2020",Isaac Adams-Hands
Must be paired with an Apple iPhone or iPad to be functional. Android would be nice.,4.0,For the price it's a solid buy.,"April 18, 2020",Christopher Gaska
"Nice 20MP resolution, perfect stitching . All I was asking.",5.0,I just love it!,"August 5, 2018",Steeve
,,"Have been a big fan of Ricoh Theta cameras for some time and have a good experience with 360 media and equipment. Here are the Pro's of the V in my experience, compared with the S and other cams: - 4k video is really good quality and copes with low lighting well (far far better than the Nikon KeyMission). - 4k video can be streamed to youtube via a PC (a driver, currently in beta, is needed to do this but it does it well). - the transfer speeds over wifi are very fast (a big step up over the Theta S) - The app is still really great. - It can be charged with any charger (Theta S would refuse to charge with a high amp usb charger) - Ability to run apps on it seems promising (edit: This is being rolled out soon 2018) - Ability to sense tilt seems promising (edit: now auto stabilises video) - Small deadzone. the lenses are close together, there's very little dead space in the image. - images every 4 seconds with timelapse mode rather than 7 - can stream to a tv that has an amazon firestick. The Cons: - Same image sensor as the Theta S. The camera has a faster processor and you should get less noise on the images, but the resolution is the same. - Image stitching seems worse.. maybe due to the new lens system.. Imagine a firmware update will fix this. (edit: some way to being fixed) - Still no SD Card slot. Don't feel like opening this one up just yet, but all the others have had SD cards hidden inside them.. these have probably been kept hidden as they'd need a fast SD card to work well with 4k video.. perhaps people would complain their card didn't work all the time if they put an access slot in? insta, samsung, mija all have this. - Still has a plastic tripod thread, this was a bit fragile and actually broke on my S. - There's no autostabilistion like on Mija or insta360 cameras, despite it having sensors to do so.. this should at least be able to be applied in post production on the app. (Edit: the autostabilisation now works) - Bit pricey really.","Reviewed in the United Kingdom on September 30, 2017",mark caswell-daniels
,,"Things you need to understand about this camera. 1. It takes 360° Spherical images. 2. It does not spin around 3. You need to use two apps. The Ricoh Theta App and the Ricoh Theta+ app. 4. You need to learn how to remove the Nadir. Check YouTube for tutorials on this.  The nadir is the image that remains of the tripod mount you use when you take a picture. 5. You need to learn about Tiny Planets.  These are app made filtered images that are pretty cool.  Again check Instagram this time for examples. 6. Learn how to take images using the self timer function. 7. You will also need a monopod with a tripod base suitable for this camera. The Ricoh one is overpriced.  I bought a carbon fibre one and a separate base. You don’t need one straight away - but as you develop your 360° photo taking skills it will be a requirement. Essentially this is the latest model of the Theta family.  (UPDATE MAY2019 THE Z1 IS NOW THE LATEST MODEL) It has a faster processor and offers 4K 360° video as well as spherical sound (with added microphone) (UPDATE- I USED THE EXTERNAL MICROPHONE AND IT ADDED NOTHING IMHO - OTHER THAN A WIND NOISE SUPPRESSING FOAM, THERE WAS NO BENEFICIAL INCREASE IN SOUND CLARITY) The theta has the best examples of stitched in camera stitching of all the cameras out there.  For the money you can’t really get  better.  So there’s one reason to get it. The camera uses its in house Wi-fi to connect to your smart phone and you take the photo using the theta app. You can extend the connection by connecting the camera to your home or any router - a feature only V can do. I would also advise getting a silicon skin straight away. Cheap enough to buy. (UPDATE - A SILICON SKIN CREATES A SHADOW IN THE IMAGE, SO BUY A CASE INSTEAD) There is a more technical side to manipulating and displaying 360° photos so you do need to do your research otherwise you will be disappointed. However if you’re set on joint the 360° revolution (pun intended) this is the best camera you can get for the money. Both the little sister and brothers of this camera the S and the SC are equally good at taking still photos - you just lack the 4K and a few other features.  So if you don’t want to spend £300+ I would advise getting one of those.  They’re a bit slower due to the processor but they are pretty brilliant too.","Reviewed in the United Kingdom on September 28, 2018",Pete E
,,"Your browser does not support HTML5 video. Prior to a trip to Hawaii and Las Vegas I wanted to get a good camera, something different, to capture the vacation. I thought about a drone, but went for this instead, and I am SO Please that I did. Some of the results are fantastic. I've put a couple ""little planet"" Conversions up. I love how these come out.","Reviewed in the United Kingdom on November 17, 2018",Chris Fletcher
,,"Je dois vous prévenir d'une chose, cette caméra m'a été offerte, je suis donc sans doute plus enclin à la trouver géniale que si j'avais dû investir mon argent... Les points positifs : - je la trouve très compacte, on la glisse dans la poche et on la dégaine rapidement. Idéale pour les ballades - rapide, on clique et la photo se prend tout de suite (pas de temps d'attente de mise au point ou autre...) - j'adore le visionnage où l'on navigue dans la photo en orientant son smartphone - finalement je l'utilise à titre professionnel, sur chantier, plus besoin de prendre des dizaines de photos et panoramiques pour se rendre compte qu'il en manque toujours un coin, en 1 clic, TOUT est là. - possibilité de la piloter entièrement à distance par smartphone pour avoir des photos complètement vierges les points négatifs : - quelques problèmes d'allumage aux premières utilisations, impossible de comprendre si il s'agissait d'un problème de batterie ... - peut être la définition un peu juste, on voudrait pouvoir zoomer encore davantage sur les images Si mon commentaire vous a aidé, n'hésitez pas à mentionner qu'il vous a été utile. Cela me fait toujours plaisir de savoir que je suis lu et que mon commentaire a pu aider quelqu'un! :)","Reviewed in France on June 17, 2019",colrol
