,,"Just to say that this great little Bluetooth remote GPS antenna works perfectly with my 16Gb iPad Mini (with WiFi and 3G chip) in an aviation environment using SkyDemon.  Flew from EBCI to LFAT and back yesterday in a C172 after having tested the setup locally last week.  Total confidence, simple setup and works 110%.  It is a neat, modern-looking unit; the ""sticky pad"" accessory works great on the top of the aircraft glare shield and never moves at all.  Connection to iPad was utterly simple and quick.  If there is anything that the design engineers could look at again, I think it would have to be the armband/straps which do not appear to be to the same high design/manufacturing standards as the rest of the kit - more of an afterthought given to the apprentice to bash out!  All in all, I am delighted with the unit, and with the Amazon ""system"".  PG","Reviewed in the United Kingdom on February 18, 2013",Paul GEE
,,"A useful device that works very well indeed but I am thankful for a previous review by G.Samara who highlighted a glitch when setting up on iOS devices.  Followed that advice and all worked well, without that I would have been scratching my head for a good while. I am using this with an ipod touch 4th gen and UK maps which is excellent for hiking on the hills.","Reviewed in the United Kingdom on September 6, 2015",hawkman
,,"A nicely compact gizmo. Works brilliantly with iPad navigation apps. I went through a short period when I thought is was malfunctioning. I have found it necessary to disconnect Bluetooth, COMPLETELY power-off the iPad, power-on and start again; but having got used to this routine, it appears to be working excellently. Without this 'niggle', definitely 5 star. The DUAL GPS Status Tool is a very useful app. to go with it.","Reviewed in the United Kingdom on September 7, 2013",Mr R
,,"I was debating wether to buy a GPS unit or not but there aren't many out there for cycling. With the brilliant map app I have on my ipad and the investment in digital maps for it I went for this instead. I am not disappointed. It was easy to set up and I have used it for walking and cycling and found it to interact with my maps perfectly. It is very accurate in its abbility to get a signal even under trees. The unit holds enough charge for a full days exploring and it doesnt sap the battery on the ipad either All I want now is to justify buying a mini ipad, that would be better for when I'm out on the bike.","Reviewed in the United Kingdom on December 21, 2013",John Varney
,,Bought to work with an iPad whilst hiking this unit performed brilliantly. Works really well with good battery life. Universal Bluetooth GPS Receiver (Wirelessly Add GPS To Your Devices),"Reviewed in the United Kingdom on December 10, 2015",B D Kiely
,,"This little device compliments my iPad, allowing trails to be recorded, footpaths to be negotiated with great confidence. A boon for anyone not so confident in their map reading skills. Used in conjunction with the OS Maps app.","Reviewed in the United Kingdom on June 5, 2016",Les Coe
,,"What more can I say? I took it out of the box and paired it with both my iPad and iPhone in minutes. Downloaded the recommended app to both devices and it works great. I now have gps on my iPad, (my priority), and it should also help save the battery on my iPhone. If I leave Apple, (never say never), I can use it on any other device. Well chuffed.","Reviewed in the United Kingdom on March 3, 2014",gizmo
""
Product:,"Broan BPS1FA30 Replacement Filters for QS1 and WS1 30” Range Hoods, Aluminum, 2-Pack"
URL:,https://www.amazon.ca/Broan-BPS1FA30-Replacement-Filters-Aluminum/dp/B000HMBPWS/ref=sr_1_28?dchild=1&keywords=electronics&qid=1606075994&sr=8-28
Price:,43.82
Overall Rating:,4.6 out of 5 stars
Reviews:
Title,Rating,Review,Date,Author
Does Not Include Carbon Filter,3.0,"While this is what I ordered, it wasn't what I wanted.  I didn't realize it does not include the essential carbon part of the filter, which is sold separately, and that I could have reused the old aluminum filters. Make sure you're aware of this before ordering.","December 16, 2017",magpie
NOT DISHWASHER SAFE,3.0,"I bought these filters to replace the ones in my Allure hoodfan SPECIFICALLY because they are listed as ""dishwasher safe"". They fit great, looked awesome, shiny and new, until I put them in the dishwasher for the first time. Now they are discoloured and look worse than the old, grease-filled ones. I would have cleaned them another way if I had known they would tarnish so badly in the dishwasher. So, don't believe the description like I did, and make sure to clean them with a degreaser spray and not in the dishwasher!","October 9, 2020",Esther M
Does the job!,5.0,Fits my Allure by Broan range hoodperfectly,"October 18, 2018",Recent Buyer
filters in name -only,1.0,regrettably these Broan filters are -POOR-- quality.  Very flimsy made and when I opened the package the screen part had -already -begun to separate from the aluminum frame !  I do think I could make better in school shop class I installed anyway -not too many will notice - BUT I notice.  my 1st sour deal  (:,"February 2, 2020",john m.
not good quality,3.0,"I bought this to replace the default factory one. this product is thiner than the factory one, which means less coverage... weight is light, so feel cheap... not recommend it if you are not in rush to buy.","August 9, 2019",cloris
"filters fit exactly as needed, but when i took ...",2.0,"filters fit exactly as needed, but when i took them out of the plastic wrap, both filters were 'dented' and i needed to straighten them out with a pair of plyers to get them to fit into the fan fixture.  VERY sharp and needed to do so carefully, and did cut myself as the item was very sharp, and was NOT about to return, but needed to advise Amazon of this defected product i received.","March 15, 2018",Amazon Customer
Works as expected,4.0,My range hood is a broan nutone and said 99010299 as the replacement part number. This products fits my hood very well.,"January 4, 2020",PV
"Broan Bps1fa30 76,2 cm en aluminium de remplacement",4.0,"Les filtres s'ajustent parfaitement.  Il y avait un coin de plié, mais j'ai pu le replacer.  IL faudrait que le produit soit mieux emballé.","November 30, 2019",lorraine lemay
Outstanding quality and price,5.0,Perfect fit. Arrived next day. Great price. Easy to order. I would’ve been lost at a brick and mortar store trying to figure out what size I needed.,"May 15, 2019",Sherry S
Just the good ones!,5.0,"I simply put them in place, like the original ones, and tadaah!!! Exactly what I need!","January 15, 2020",Donald
Perfect Fit,5.0,"Exact fit and finish for the Broan Allure hood vent, way cheaper through Amazon then buying in store and best of all I didn't have to leave the house to find them. Very good!","November 22, 2018",Captain Triumph
Happy,5.0,Great product and fast shipping. Works perfect.,"January 26, 2020",M Moore
Good,4.0,Livraison rapide et  produit de qualité .merci,"December 29, 2019",mehdox
Très bonne qualité,5.0,Très bon produit afin de pouvoir avoir une fan qui puisse faire son travail.,"August 2, 2020",Danielle Courtemanche
Good stuff,5.0,"Good stuff, good price. Quick deliverd.","July 20, 2020",Anton Viveen
Good quality,5.0,Fits perfectly.. nice and sturdy,"May 19, 2020",Ann R
Perfect,5.0,Perfect replacement.  Nice when things workout so well.,"September 24, 2019",A and E
Perfect fit,5.0,"Perfect fit, Nice to have new filters in place of the worned out ones I had on my Nutone Allure.","February 19, 2019",DZ
Exact fit,5.0,"Needed it, had a old part # and this is a direct replacement for it, genuine product, will buy more in the future","November 25, 2018",Gopal Ramsumeer
Expensive,2.0,Fits well but given the quality it is very expensive,"July 6, 2019",VEE-DAY
good value,5.0,good replacement,"February 2, 2020",copins50
Satisfied,4.0,"Though this product is not exactly like the factory replacement part for this unit, the fit and function is good enough. Most importantly, no more driving endlessly around the city looking for parts.","May 2, 2019",PPP
Fresh and New!,5.0,Perfect replacement for my old greasy filters.,"April 2, 2019",Bwod
Fits older models QS3,4.0,Lesser quality than originals but does the job for the price. Fits older models QS3 too.,"November 21, 2019",Crazz
Bon filtre,5.0,Super,"February 8, 2020",Client d&amp;amp;amp;#39;Amazon
Fits,5.0,Fits my allure range hood just fine,"May 22, 2019",Local guy
Great product,5.0,Works and fits perfectly!  well worth it!,"June 16, 2019",Kim M
Broan replacement Filters,4.0,Good purchase happy with product,"June 6, 2019",Amazon Customer
Overall a good product,4.0,"Fast shipping, perfect fit well built but a little to expensive.","November 14, 2019",A CANADIAN BUYER...
Hard to find elsewhere and the prices were ridiculous.,5.0,"Work perfectly, great price. Sent in a secure box, there were no dings or bends.","September 25, 2019",Simon
Saved me a trip to Home Depot!,5.0,It works.,"November 3, 2019",Mimita
Nice,5.0,Fits perfect onto our hood,"July 18, 2019",KM
Perfect,5.0,Great product. Half the price oc the local retailer.,"November 10, 2018",405195
Five Stars,5.0,Right on the money fitted perfectly. No more big box store prices for these types of things,"February 27, 2018",Amazon Customer
Work very well with my hood. Perfect size,5.0,Excellent price and convenience.,"October 31, 2019",awais h.
True to its description,5.0,This product was true to its description fit and gives the stove hood a brand new look,"October 19, 2020",Maria sivilla
Great buy,5.0,Good price perfect fit!,"April 13, 2019",Helenoux
Reglage mon probleme de mouche,5.0,Merci amazone parfait,"August 29, 2019",SUZIE
happy,5.0,fit well and looks good,"October 17, 2019",Amazon Customer
works great and good match,5.0,Excellent fit,"December 3, 2019",Rami912
"Bought for our Allure SS 30"" rangehood fan and is ...",5.0,"Bought for our Allure SS 30"" rangehood fan and is OEM. Saved a bit of money from buying on Amazon.","June 12, 2017",mgsquad
Perfect fit,5.0,Perfect fit. Quick turnaround on delivery.,"December 2, 2018",JoHo
Came in very quickly,5.0,Simple install. Should replace these more often.,"June 11, 2020",Dan Postma
Rangehood Replacement Filters,5.0,"Very cost effective to replace, rather than spending hours trying to clean.  Surprised at how efficient my range hood now is with the new filters :)","April 3, 2019",Caroline Hocking
Five Stars,5.0,It's a filter. Nothing to add. It works.,"August 29, 2017",Mathieu
Good product,5.0,Fits just right and does not restrict air flow as much as the original.,"January 26, 2019",Emanuel Medeiros
Works Great,5.0,Exactly like described and fit perfect,"June 29, 2019",Charlene
excellent service,5.0,received quickly good product and price,"February 20, 2019",AHSEN
Good,5.0,They fit well and work as expected.,"January 20, 2019",HAL
Four Stars,4.0,Its a filter - not much to say. It works as stated.,"April 18, 2018",Amazon Customer
Competitive price,5.0,The product was manufactured by Broan and exact samething what we get on home depot or other retail stores. With no quality compromised the price is very competitive.,"August 4, 2016",Prakash
Nice filters!,5.0,Works as intended!,"September 21, 2019",AlexanderButyaev
satisfaction,5.0,Très satisfait,"January 3, 2019",Client d'Amazon
Good,4.0,It's like original,"June 24, 2020",Amazon Customer
Bonne qualité bon prix,5.0,Ventilateur,"August 8, 2019",Lawrence Michaud
Fit perfect,5.0,"Perfect fit, working well, fast delivery.","August 1, 2019",iulian
Fit perfectly,5.0,Replacement went with out a hitch....awesome communications,"January 3, 2019",Jason P.
Same high price as local hardware,4.0,As described,"October 23, 2018",Robb
Functional but flimsy.,3.0,Functional but flimsy.,"December 27, 2019",Stephen Harper
Parfait,5.0,Parfait,"November 5, 2018",D Potvin
""
Product:,Elenco EP-50 Electronic Playground 50-in-one
URL:,https://www.amazon.ca/Elenco-EP-50-Electronic-Playground-50-in-one/dp/B00000IUD2/ref=sr_1_29?dchild=1&keywords=electronics&qid=1606075994&sr=8-29
Price:,36.57
Overall Rating:,4.4 out of 5 stars
Reviews:
Title,Rating,Review,Date,Author
Amazing kit to introduce the next generation to electronics,5.0,"I had one of these kits in the early 90s as a kid and absolutely loved it. It also led me into a pretty decent career path where I work for a good company with good pay. I got this set for my 3 and 5yr old nieces and in about a week they have managed to put together about 8 of the circuits, including the AM radio transmitter. This kit has taught the 5 year old how to wire things according to the diagrams and always go over all the connections a 2nd time before she connects the battery, and so far everything has worked first time for them. Great way to help start the kiddos early and make sure we have a next generation of electronics engineers to keep the world going.","April 10, 2020",admin
Decent Price for a good electronic kit!!,4.0,Your browser does not support HTML5 video. Not very sturdy It only lasted 1 month.  Yes the transistors lasted a few months when I bought the kit earlier the Radio projects work well and the transistor's NPN can be replaced if needed. It has nice projects and it explains it very well. I like the 1.5 v and 9-volt battery tester the most Unique.,"June 12, 2018",Janet L.
Very interesting toy,4.0,I bought this for my 6 year old grandson to show him the basics of circuits. It is mostly too advanced for him. We have done some of the easier projects but it gets complicated in a hurry. It will be fine when he is older.,"January 13, 2020",Debbie O
Excellent pour apprendre pour les 10 à 100 ans,5.0,"Les nouveaux kit d'apprentissage d'électronique laissent souvent tomber les bases essentielles qui font vraiment comprendre comment ça fonctionne. Ce sont des kit ""presque déjà tout fait"". Tandis que ce kit est un vrai bon kit comme nous trouvions il y a 30 ans avec de vrais composantes électroniques. Tout pour vraiment bien apprendre !!!","June 12, 2019",ggbce
Cheap quality,2.0,Cheap & low quality but I only bought it to take the parts & springs out so I don't mind. The instruction manual looks pretty good.,"February 1, 2019",Sherri
Very pleased,5.0,"I received this item 1.5 days after ordering.  Very pleased with the content, layout and lessons/experiments.  Both my 8 and 9 year olds are intrigued and were very anxious to begin.  These will be their summer projects.  It is simple and not too many parts and easy to read, understand and follow. Thy have done the first experiment and the youngest took it for show and tell.  Excellent product. I would recommend. to all.","May 7, 2013",Broomsey
“This is the best educational present I’ve ever got,5.0,"I bought this for my nephew for Christmas. He opened it right away and played with it most of the night. In his words, “This is the best educational present I’ve ever got!”","January 8, 2018",Amazon Customer
Easy to use and very instructional,5.0,"After me showing him how to do it and how to follow the directions, my eight year old built a radio all by himself. His sense of accomplishment was worth way more than I poaid fore this set. Wish they still made the big sets like these.","May 23, 2020",Bill the Book Reader
looks great and arrived fast,5.0,"is a christmas gift, so will not be tried until then. looks great and arrived fast","November 22, 2017",Amazon Customer
Me and my son LOVE this set!,5.0,"Excellent beginner/intermediate electronics experiment set.  Great 75 page book with explanations and schematics, and also wiring codes.","March 24, 2016",Doug Becker
Superbe jeu! Mon fils de 7 ans l'adore. ...,5.0,"Superbe jeu! Mon fils de 7 ans l'adore. Les connexions sont faciles à effectuer et solides, les instructions sont claires et facile à comprendre. J’adore","January 17, 2018",Amazon Customer
Five Stars,5.0,Grandson absolutely loves it!!!,"August 1, 2018",Cheryl Waldram
Fun for all agea,5.0,My son has gotten lots of use and fun out of this. As well as my friends and husband.,"January 18, 2018",Amazon Customer
Broke after 1 use - no response from company,1.0,"My child used this once, and it stopped working. I emailed the company (there's a sheet in the box advising to email for customer service) and they didn't respond. Waste of money.","January 10, 2019",Melissa
Not just for kid's !,5.0,"Bought this for a 63 year old friend, he wanted to learn and has been happily enjoying learning from it !","May 24, 2016",Fraser D. Riddell
Excellent product,5.0,This item was a gift and the person was very satisfied.,"January 1, 2020",Sonia
Excellent Product,4.0,This was a present for a friends Son!,"February 16, 2019",Meryl Stanton
merci,5.0,enfant 8ans,"January 27, 2019",veronique hetu
sad they didn't improve design by much,2.0,Had a similar one in the 80s... sad they didn't improve design by much. Oh wait someone else did !,"January 12, 2017",Nick_A
parfait,5.0,super!!,"July 17, 2019",Cindy
Four Stars,4.0,"My 8year old finds it a little bit intimidating, more suitable for older than 8.","September 11, 2016",Olu Agboola
Instructive and satisfied.,5.0,Arrived on time. Really helpful to introduce kids to electronics.,"November 12, 2016",Joel Tousignant
Five Stars,5.0,gift for granddaughter,"July 12, 2018",Gladys Clarke
Would purchase again,5.0,Excellent product. Good challenge for the kids,"February 13, 2019",Very Impressed
fun,4.0,great fun,"January 23, 2019",ralph p.
Five Stars,5.0,Kids loved it,"December 27, 2017",Marie K
Fun product,5.0,Don't forget to buy the batteries!,"December 13, 2017",cardsonaring
Good for Xmas present,5.0,Good for my grandson Xmas present,"December 4, 2017",gawa
Grandson loves it,5.0,Explanations and experiments are well described,"February 18, 2018",ColinT
Five Stars,5.0,Awesome!!!!!!,"November 24, 2017",Alonzo
Five Stars,5.0,thx,"February 19, 2018",SEM
The kids love this. So many different things they can do ...,5.0,The kids love this.  So many different things they can do with it following the instructions.,"April 1, 2016",CannedAm
The transistors used are a bit fragile suggest more robust ...,4.0,The transistors used are a bit fragile suggest more robust types or wired in safety resistors to prevent over current. Also suggest easier parts replacement and spare parts to be included.,"January 16, 2016",G.May
Electronic,4.0,Old fashioned style but we have had some fun with it.,"January 1, 2016",Alex Murchison
As described,5.0,Exactly what I wanted. It will be a gift,"December 6, 2018",Sandy
Five Stars,5.0,eductif,"March 20, 2018",sylvain morin
Fun and educational,4.0,My 9 year old loves it!!,"March 15, 2019",Relic
Five Stars,5.0,very good product and very educational,"July 1, 2016",jenny
Five Stars,5.0,Great electronic kit for kids to learn about basic electronic.  Had one when I was younger.,"January 21, 2017",Shiisz
Four Stars,4.0,"Thanks,,","July 19, 2017",Riyadh N.
Four Stars,4.0,Son loves it,"February 21, 2016",Nick
Good learning toy!,5.0,Our 10 year old grandson loves it.  But now that the weather is finally nice I'm not sure if it is getting used much.,"June 19, 2013",Terry-Lee Stephan
,,"Amazing learning tool. Within a day of my 8 year old opening the box, he'd learned how to make his own flat screen TV from a few food tins and an old beer bottle. Macgyver eat your heart out. Would recommend. And to the guy who down scored it due to it being 'flimsy', what exactly are you expecting?  If used as a step ladder, ok granted its flimsy. As a stepping stone for future bomb disposal experts, its absolutely what id expect. If you have boys, they will love it.","Reviewed in the United Kingdom on December 25, 2017",Mr. B. Grinnall
,,"Fortunately I was present when the youngster who received it as a Christmas present attempted to make the first project (a simple LED light & switch).  It did not work.  A quick check with a meter revealed that the battery had been connected to the wrong terminals (polarity of battery reversed).  Easily compensated if you are experienced, but it confused the youngster that he could not follow the diagrams for any of the projects but always had to swap the connections to the battery terminals.  Very shoddy quality control!!!  I have a feeling that one of the electrolytic capacitors was also reversed - if not then it was very leaky which made the bistable circuits unreliable.","Reviewed in the United Kingdom on January 2, 2019",Kindle Customer
,,"Not happy at all with this kit. A Christmas present for my son which very quickly proved to be substandard. First I noticed that the variable resistor was connected to the spring connectors back to front and the pointer was incorrectly fitted. Then I found that the transformer didn't work. A note in the box said to contact the manufacturer, not the retailer, in the event of any defects. I sent them an email asking what I should do as I'm in the UK and they're in the USA but have not even received a response.","Reviewed in the United Kingdom on January 1, 2019",Dave Rawson
,,I TRIED SO HARD TO FIND SOMETHING A LITTLE DIFFERENT FOR MY 11YR OLD GRANDSON'S BIRTHDAY and this Electronic Playground was just right.  He spent hours doing the projects and his Dad was impressed too!!!  Would highly recommend for those boys and indeed girls who have an inquisitive brain and want to know how things work.  Marvelous !!!,"Reviewed in the United Kingdom on November 14, 2018",Maxine
,,Bought this for my 7-year-old. The instruction booklet is very informative; so far he only builds the circuits but there is plenty of explanation of how the circuits work which one day he'll get to. Build quality is pretty good and variety of circuits very good.,"Reviewed in the United Kingdom on February 23, 2019",Chris Key
,,"Brilliant purchase and love the book that comes with it .. my 8 year old loves it and has learned and is learning loads. I am really pleased with this purchase. There are 50 experiments and we have got up to the third so far, although my son wanted to do more, he cant get enough of it. Fast delivery .. 100% happy","Reviewed in the United Kingdom on January 26, 2017",Willow
,,"I would have given 5 stars had the battery terminals been wired the correct way round.. Luckily I used to like to play with my brothers almost identical board 50 years ago and then my sons 28 years ago. One I figured it out my grandson loved it. His other Grandparents had also bought him a very expensive version, but he much preferred this one.","Reviewed in the United Kingdom on January 8, 2019",June Hill
,,My son loves using this with his grandpa but can also follow instructions and complete alone (10 years),"Reviewed in the United Kingdom on December 20, 2015",dawn critch
,,bought this for my godso who isnine and a haf years old. He likes science and experimenting so its ideal for him. Plenty of interesting experiments to carry out. Good value for money,"Reviewed in the United Kingdom on December 8, 2016",C. Nielsen
,,I brought this for my 11 her old grandson he is blind and has had great fun finding his way around this  recommend  it it's fun,"Reviewed in the United Kingdom on April 12, 2019",Amazon Customer
,,Great present for my eight year old. Really good instructions too.,"Reviewed in the United Kingdom on January 9, 2017",A Smith
,,"Item was in great condition love it, Thank you....","Reviewed in the United Kingdom on October 30, 2018",William Ferris
,,Grandson really enjoyed this Electronic Playground. Has had lots of fun creating things.,"Reviewed in the United Kingdom on September 28, 2017",lyn liddle
,,Arrived in good time and in excellent condition.  Easy for age 10+ to start using and understand; no special tools needed and good fun too.,"Reviewed in the United Kingdom on January 4, 2015",KC1234
,,Faulty and poorly made. Not recommended,"Reviewed in the United Kingdom on January 6, 2019",Chris
,,Very good electronics kit. Only gripe would be the accompanying booklet. Could have been child friendly.,"Reviewed in the United Kingdom on February 24, 2017",Sid
,,This product is extremely good for people who want to learn about electronic circuits and has easy to understand instructions,"Reviewed in the United Kingdom on January 2, 2019",John
""
Product:,"OrgaWise Large Travel Cable Organizer Bag Electronics Accessories Case Three-Layer for iPad Mini, Kindle, Hard Drives, Cables, Chargers(Three-Layer-Grey)"
URL:,https://www.amazon.ca/OrgaWise-Electronics-Accessories-Three-Layer-Three-Layer-Grey/dp/B07T1QXP1V/ref=sr_1_30?dchild=1&keywords=electronics&qid=1606075994&sr=8-30
Price:,23.99
Overall Rating:,4.3 out of 5 stars
Reviews:
Title,Rating,Review,Date,Author
Great organizer,5.0,"As a Mac guy with all these adaptors, I really enjoy this case. It’s great for travel, or just staying organized around the house or the office. The only thing that could have made it better is having a little bit better structure, something hard embedded between the fabrics that enables a bit better sturdyness.","February 29, 2020",Matt
"Good Size, Dividers are nice.",4.0,"This is a good case (I have a few, good and bad) the velcro dividers are great for customizing. The size is good without being huge. The one complaint is that it arrives, flat packed in a bag, and the side walls now have a crease in them which keeps it from holding its shape.  I would have appreciated if it was packed with some paper to maintain its form.","April 16, 2020",MKITGO2
