Smaller than I thought,4.0,It was a gift and it was not what I though more for a small kid maybe up to 5,"February 6, 2019",Busy mom
Good gift,5.0,Great gift,"October 20, 2018",Einstein
Really bad quality belt,2.0,No something which I was expecting. The belt really need to get more improvement in design and comfort because it really hurt when you wear it.,"October 16, 2019",Adeel Amir
Five Stars,5.0,Good for small girl! Thanks! She is happy!,"January 10, 2018",Tatiana K.
Crap,1.0,Total waste of money. It's huge on a child's wrists. Counting steps is terrible!! You sneeze and it adds steps. All around do not buy...,"November 3, 2019",Brett
Didn;t work,2.0,Item never worked - company was good and issued a credit,"December 3, 2019",Ants
Good for girls in KG/Grade 1,5.0,"Daughter very satisfied, not super fancy,  but I see she is visibly happy.","August 22, 2019",Rix
As advertised,5.0,"Bought 2x, My daughters adore them. Fast delivery as advertised.","November 11, 2019",Amazon Customer
good,4.0,i bought this for my daughter and she loved it.i would give it five star  but the camera us not good quality,"June 21, 2020",Lily
Great gift,5.0,Granddaughter Christmas gift.,"December 9, 2018",Amazon Customer
Dont waist ur money,1.0,Does not work.. May as well be for show cannot program it as well it is huge on a childs wrist.,"June 5, 2020",John C
look good,5.0,my daughter like it so far....,"October 30, 2018",jacques dionne
Does not charge :(,1.0,Its fun amd well made but I dont know why it does not charge ! No more watch in few hours... Think I will send it back...,"December 25, 2018",mélanie
Nicely made,4.0,Camera isn't very good but daughter likes it,"January 7, 2019",Amazon Customer
Eviter a tout prix. Don't buy this,1.0,Elle a fonctionner 2 jours,"April 29, 2020",Annabelle Leblanc
I won't recommend it to anyone,2.0,The watch does not hold a charge. Less than an hour the charge runs down. I won't recommend it to anyone. My child was very disappointed.,"March 2, 2018",Ilene
GBD Smart Watch,5.0,My daughter loves it,"July 7, 2019",Mckayla
Decent for the price,3.0,"Graphics arent great, but for the price point it made my daughter excited.  Like the pedometer and time functions as well as games available.","February 1, 2019",Cara Mace
Cette montre a été fonctionnelle environ deux (2) semaines.,1.0,"En date du 15 octobre 2019, cette montre ne se charge plus. Le chargeur a été vérifié et il est fonctionnel.","October 16, 2019",Noella Giguère
Not a good one,1.0,No so good.. material is very cheap.. not a good quality camera.. over priced..,"May 21, 2018",A. Zakir
N’a pas été très utilise,3.0,C’était pour cadeau,"December 25, 2019",Ginette B.
Nice,4.0,Good,"December 28, 2018",Gurbinder
Quality of glass,1.0,"It was not value for money, glass for watch got scratches.","September 22, 2020",Asad habib
Might as well be a Lego block.,1.0,Product is cheap plastic and useless. You get what you pay for.,"September 28, 2019",Purchaser
Its nice kids watch but main switch stops working right away,3.0,"Its nice kids watch but main switch stops working right away, I paid 50$, not worth at all. I don’t recommend this watch","May 7, 2018",Surkhab
Two Stars,2.0,Trop gros pour ma fille de 5 ans.,"August 6, 2018",pat
Camera,3.0,Unfortunately the camera pictures are bad and very weak,"December 16, 2019",Almaz
Not worth,1.0,Not really a good quality,"February 2, 2020",Safwan
Good product and very good delivery.,4.0,Gift for 7 year old grandson - he loves it.,"March 10, 2020",barbara rainville
Waste of money,1.0,Waste of money,"August 25, 2020",Madiha
Four Stars,4.0,it is so much fun the ggame are awesome everything about it is amazing,"May 30, 2018",rhonda chisholm
Five Stars,5.0,"Good one as in the website,  delivered on time","January 5, 2018",Mustafa Ahmed Al-Jumaily
good price,4.0,good delivery and product,"December 28, 2018",The Hao Nguyen
Bof,3.0,Jeu,"September 21, 2019",Kelani
A replacement or a refund,1.0,It is not working,"May 13, 2019",Mel
One Star,1.0,"Not as described, camera and games are a joke","April 5, 2018",Abdulsalam Al-Fasih
Four Stars,4.0,My daughter loved it!,"January 28, 2018",Lydia Milazzo
My kids were super disappointed that they didn’t work for a full evening,1.0,"Do not purchase!! I ordered 2, 1 would not charge, and the other only stayed charged for an hour after being plugged in all night!! My kids were super disappointed that they didn’t work for a full evening. I will be returning these!","December 24, 2017",Sharla
One Star,1.0,arrived damaged and parts missing,"January 22, 2018",Lisette
Cute,5.0,My baby loves it,"June 10, 2019",Letty
A1 seller,5.0,A1 product,"December 18, 2019",Tnt
""
Product:,"ProCase Electronics Travel Organizer Storage Bag, Double Layer Universal Traveling Gear Accessories Carrying Case Pouch for iPad Mini Cables Phone Chargers Adapter Flash Hard Drive and More –Black"
URL:,https://www.amazon.ca/ProCase-Electronics-Organizer-Universal-Accessories/dp/B07B95DV1J/ref=sr_1_46?dchild=1&keywords=electronics&qid=1606075994&sr=8-46
Price:,22.99
Overall Rating:,4.6 out of 5 stars
Reviews:
Title,Rating,Review,Date,Author
"A great fit for your budget, style and electronics+ storage needs!",5.0,"Needed an electronics organization bag that holds all of my needed cabling and devices on the go. This holds 95% of what I needed it to do, excluding a Bluetooth speaker that is too tall but will fit if you squeeze it in. The three separate storage areas are very versatile and I was pleased with how much I could fit and customize the bottom dividers. I even found room for my Xbox controller with the connected attachment to have its own spot! I would not recommend it for your tablet to go in if you are storing other components with hard or sharp edges. Quality materials I can see lasting a number of years. It is a decent weight with semi-firm walls. It is waterproof for spills and rain on the exterior. The colour is pleasing to the eye as well as the quality of zippers. Having dual zippers on both is a useful feature for ease of access. This is a great value for what you get. The size is easy enough to fit into a backpack or luggage but too big for an average size purse, for reference. My next purchase would only be for something larger with a hard case but that may be venturing into the next price and size category. An excellent fit for your budget, style and electronics+ storage needs!","August 11, 2020",Paul Magruder
Perfect size for a large battery pack,5.0,"I've been struggling to find a case for my 50 000 mAh battery ( https://www.amazon.ca/gp/product/B01BLXY3B6 ), but this case fits perfectly. Plenty of room for the battery pack, its charger, charging tips and cables. The dividers are velcro, so I just stuck them to the inside of the main compartment along the perimeter and it's still a very nice fit. Could fit a few more cables in the top compartment as well - maybe a small travel USB charger. Fully packed with my battery pack, it's a little large for every-day-carry; but if you knew you were going somewhere you'd need it, the carrying handle makes it an afterthought to grab and toss in the car. Too big for EDC, but very portable, we'll say.","December 22, 2019",Amazon Customer
Definitely Worth The Price,5.0,"I initially meant to order something else but kept this one in my order by mistake. However, after receiving the organizer (within 10 hours of placing my order) my mistake turned out to be a blessing. This bag is has endless uses for anyone who likes to keep anything neatly organized such as daily essentials (wallet keys, hand sanitizer, portable phone charger, multitool) or specific tools like (voltage testers with the appropriate accessories)","February 24, 2019",Ian
"Lots of space, adequate padding.",5.0,"I purchased this case to transport my RPi, wireless Rii keyboard, and various cables. The case is probably much lager than I need. It holds the RPi, keyboard, power adapter, a 6' hdmi cable, 8' 3.5mm audio cable, a couple of usb cables, and a usb wall wart. There's still plenty of room for more things!","October 19, 2018",Brandon D.
Very Cheap and Flimsy,1.0,"I've used something else from ProCase and love it, but this one was delivered completely smooshed. It was warped and the material was too soft to try and manipulate it back to it's regular form. Really cheap and flimsy in my experience (obviously) and I definitely do not recommend this particular product to anybody.","May 26, 2019",Tyler C.
Je le recommande,5.0,Belle étui de qualité et beaucoup d'espace pour y ranger plein de fils et accessoires pour cellulaire ou pour portable,"April 19, 2019",Pascale QC
Nice bag,5.0,"Used for 1 trip. Worked well. Held all my electronics, was smaller than I thought it would be","March 18, 2020",Leland
Good quality,4.0,"Good quality product but bigger than what i needed, a little to height To fit in my purse","March 4, 2019",MellyB
Très utile et fonctionnel,5.0,"Pour ranger toutes les prises, tous les fils de iPod, iPhone, iPad ainsi que les appareils!","September 19, 2018",Andrée-Anne Massé
a bit overpriced,2.0,"You got what you paid for, better then nothing","July 21, 2020",SK
Nice,5.0,Perfect,"January 18, 2019",Amazon Customer
Lots of pockets for cords,5.0,Good,"May 25, 2020",Jamie Grey
It does the job really well,5.0,It does the job really well for a reasonable price,"August 28, 2020",Victor Cardins
Works + sturdy,5.0,Love it! Received it in time. Has enough room for a small bluetooth speaker and all your wires.,"August 1, 2019",Marco
Perfect for traveling my headphone,5.0,The padding is good. Zipper seems quality. No manufacturing defect. The sewing are very well done. Perfect size for my headphone. Very satisfied!,"January 2, 2019",Client d'Amazon
Rangement pratique,4.0,Très utile pour le rangement de câble,"September 18, 2020",julien
As Advertised.,5.0,"Fits a Greenlee DM830A, its accessories and a few tools.","January 7, 2020",JH
,,"It is a shame that this product smells like petrolium because otherwise it is a well put together and thoughtfully designed product. Sadly it has that rubbey plasticy industrial smell which in my experience never comes out, and seeing as this will be travelling with me in a backpack i don't want to have to put up with this smell. If they can fix this it would have been a 5 star review.","Reviewed in the United Kingdom on February 11, 2019",Amazon Customer
,,I found this case to be ideal for my needs and kept all my cables etc in one place. The quality of the case was 5 star.,"Reviewed in the United Kingdom on August 16, 2019",L Ewan
,,Great item suited my needs down to the ground,"Reviewed in the United Kingdom on September 4, 2018",Amazon Customer
,,"I originally purchased this case for my tech gear but as soon as it arrived I knew this case was destined for greatness... Those of you that wear chunky wooden beads and quirky, unattractive brooches will know that it’s impossible to find travel cases for such treasures. Yet here it was, a case like no other, with room for both beads and brooches. My only problem was...where do I store my tech? The solution was clear, another case was ordered and the chaos of cables became a harmonious symphony of order. Now, if only the case came in different colours, I wouldn’t be pulling out my precious jewels in business meetings when scrambling for my travel mouse. #HintHint","Reviewed in Australia on July 26, 2019",NoHomeCook
,,"Acabo de sacar de varias cajas y cajones los distintos conectores, tarjetas de memoria, adaptadores, y demas aparataje auxiliar que tenia en diferentes cajas y cajones. He tirado a la basura los que no sirven y cooocado ordenadamente en este bolso los que van bien al movil, camaras fotos, bateria adixcional y iPod. Así cuando salga de viaje o vaya a utilizarlos sé dónde están. De momento una compra acertada. He ocupado bastantes de los distintos departamentos apartados. Recomiendo nada mas abrir el paquete y las cremalleras dejarla que se airee. El material parece aprpiado para el uso que se va a dar.","Reviewed in Spain on December 6, 2018",Tony
,,"I've been looking for many cases and often it's a lottery because you don't know how it'll work out until you can inspect it in your hands. This fabric case has plenty of storage for SD cards, thumbdrives, phones, wifi hotspots, cables, or headphones (if you can fold them flat). One compartment can fit a Samsung S10-sized phone, and another compartment will fit larger phones or tablets, around 8 inches I think. One compartment is configurable, you can modify the layout and sub-compartments by re-arranging the velcro dividers. Important to mention - the velcro dividers are quite sturdy and will prevent the case from being squashed. No, it won't protect you if someone stands on it or puts a 100-pound box on top of it, but it will survive most travel scenarios. This is something that wasn't mentioned in the product descriptions so it exceeded my expectations. Finally, I was extremely surprised to receive it within just a couple of days, this is unheard of in Western Australia, especially during the Xmas rush when the post is always delayed. I don't know how they pulled it off but props to the team for such speedy delivery.","Reviewed in Australia on December 18, 2019",Mac
,,"Ein halber Stern Abzug, weil die Netztasche im unteren Reissverschlussteil der Tasche etwas schief angenäht ist. Ansonsten bin ich sehr zufrieden mit dieser Tasche. Das Preis-/Leistungsverhältnis stimmt. Ich habe meine diversen Kamera-, Handy-, Tablet-Kabel, Speichermedien, Ministativ, Powerbank und sonstigen Dinge alle schön übersichtlich verstaut und kann jetzt bei einer Reise einfach nur die Tasche greifen und habe alles dabei, was ich brauche. Das war das Ziel. Die Tasche ist (bis auf den einen Einsatz) sehr gut verarbeitet. Die Qualität der verarbeiteten Materialien (Obermaterial, Reissverschlüsse) verspricht eine lange Haltbarkeit. Für diesen günstigen Preis kann ich die Tasche uneingeschränkt weiterempfehlen. Update: Einen chemischen Geruch konnte ich nicht feststellen. Riecht halt ein klein wenig neu, so wie andere Taschen und Koffer auch, aber nicht intensiv und nur wahrnehmbar, wenn man direkt mit der Nase rangeht.","Reviewed in Germany on May 28, 2019",Kathrin S.
,,"Me dedico al mundo del cine, en el apartado de audio en ocaciones conseguir estuches o donde guardar el equipo es complicado, vi este producto en oferta y le dí una oportunidad, la primera vez vine defectuoso, pero el reembolso fue rápido y sin problemas, al llegar no me arrempetí de nada, tenía suficiente espacio para mi grabadora TASCAM DR-40 y más accesorios, el exterior es más robusto de lo que parece, me a protegido bien el equipo y lo a mantenido en orden. Una buena compra para un sonidista independiente","Reviewed in Mexico on July 8, 2019",El Tortas
,,"Dire che è capiente è poco; ci posso inserire qualsiasi tipologia di cavi, e nelle tasche dedicate alle chiavette spesso posso farne entrare due nella stessa se sono sottili. Nello spazio non delimitato da cerniere ma dalle fascette a strappo( che reggono bene) ci ho potuto inserire il mio speaker bluetooth e un paio di caricatori. Le cerniere di chiusura della valigia sembrano molto resistenti e permettono di portarla comodamente a giro senza rischi di dispersione cavi. Per chi deve fare cambi continui di cuffie, chiavette e caricatori vari, è il prodotto ideale.","Reviewed in Italy on October 17, 2020",Roberto Ciccarella
,,"I materiali sono abbastanza buoni, al tatto anche le cuciture sembrano resistenti. La facevo un po' più grande, effettivamente è un po' piccola, ma nonostante questo sono riuscito ad far entrare svariati accessori per la fotocamera è smartphone, cavi usb e carica batterie. Mi sarebbe piaciuto un po' di imbottitura in più, ma per il resto va bene.","Reviewed in Italy on January 21, 2019",TANOLOM
,,"Bonjour à tous, Me déplaçant toujours avec d'objets (caméra, enceinte, disque dur, etc) j'ai décidé d'acheter un sac de rangement afin de centraliser tout ces objets dans un même endroit. Ce sac est très pratique et comprend de nombreux rangement comme vous pouvez le voir en photo. Cela dit, une bandoulière serait apprécié afin de porter plus confortablement celui-ci. En tout cas, je recommande vraiment cette saccoche pour les gens désireux de ranger soigneusement son matériel informatique et/ou électronique.","Reviewed in France on August 27, 2018",Romain DESLANDES
,,"Cabe bastante bien cosas pequeñas y de uso personal, es un buen compañero de viaje y sus materiales son muy buenos, la verdad tarde en calificarlo precisamente dando tiempo en usarlo pero muy satisfecho con la compra","Reviewed in Mexico on August 19, 2019",Leonel
,,"Personalmente lo he estado utilizando para la universidad, no para viajes. Por tamaño, se ve que cabe perfectamente en una maleta. Los materiales son totalmente premium y son resistentes. Tiene su espacio dedicado a cables en el ""piso"" de arriba, pero en la de abajo trae unas partes desprendibles con velcro, para que que tú le des el tamaño deseado al ""piso"" de abajo. Me ha protegido de manera exitosa cables, mouse, disco duro y en ocasiones un Nintendo 3ds. Indispensable tanto para transportar como para dejar los cables y aparatos pequeños de tu hogar ordenados.","Reviewed in Mexico on September 2, 2019",Seth Rafael Meza Muñoz
,,Materiali di bassa qualità i divisori interini si sono staccati al primo utilizzo dopo due attacca e stacca le cerniere non sono affatto fluide ma si continuano ad impigliare guardate altrove ve lo sconsiglio non è affatto fatto bene l'idea è buona ma i materiali sono troppo di bassa qualità,"Reviewed in Italy on March 19, 2019",mada1991
,,Muy buen producto. Las cosas quedan muy bien recogidas con las cremalleras y gomas. Pero lo que más me gusta es que una parte del estuche es más alta y permite meter con cierta comodidad los cargadores. He llegado a meter una bomba de bicicleta pequeña también junto con cables y demás. No lo veo para una tablet pues debería ser más grande.,"Reviewed in Spain on February 20, 2019",Nowonder
,,"He comprado este organizador para llevar de viaje todos los accesorios para los móviles. Es cómodo y espacioso para lo que yo necesito. Llevo usándolo un par de semanas, parece bien hecho y acabado, hay que darle más uso para ver la durabilidad.","Reviewed in Spain on January 9, 2019",Cliente Amazon
,,"Ottima borsa per organizzare tutta l’ Elettronica da portare in viaggio, io la utilizzo per cavi, batterie esterne, hardisck, gopro e tante altre cose che mi servono in viaggio o per lavoro. Prodotto di buona fattura e tessuto resistente. Lo consiglio anche per l’ Ottimo prezzo.","Reviewed in Italy on September 24, 2018",Nicola83
,,"I was surprised at how good the quality of this item was when I first opened the package. Lots of room for cables, hard drives, leads and much more. Plenty of space. Great for travelling, or put it in your work bag or laptop bag. Would definitely recommend this product.","Reviewed in Australia on August 24, 2020",Michael Collyer
,,"Ce Procase contiens mon chargeur USB RAV Power avec son cable alimentation, Batterie Jackery Giant+ 12000 mAH, Airbox Orange, Souris Logitech, Chargeur PC Asus dans le grand compartiment, et mon DD Samsung T5 avec 6-8 divers fils USB dans le petit compartiment. Tout y rentre et est bien protégé. Par contre, le Procase est un peu volumineux, trop de mousse a mon point de vue.  Il est utile pour des grands déplacements en mission: tout a sa place donc moins de chances d'oublier quelque chose, et on ne fouille plus dans son sac a chercher des objets migratoires tous en noir.  Par contre, il est trop grand pour le quotidien, mais c'est pas pour cela que je l'ai acheté. Points coutures et zip paraissent bien solides.","Reviewed in France on November 15, 2018",Planetary Consultant
,,"En esta época donde tenemos muchos aparatos eléctricos, es indispensable el orden. Este estuche me vino excelente, nunca había tenido tan a la mano todos los cables que necesito.","Reviewed in Mexico on January 6, 2020",Raúl
,,"Muy buen organizador de cables y accesorios para un llevar organizadas las herramientas de trabajo. El cargador de mi laptop, diadema plantronics, mouse alambrico, audífonos, memorias usb, memorias sd,. Lo que no me gusto, es que no se siente con materiales tan durables o de mejor calidad.","Reviewed in Mexico on August 4, 2019",Luis Coiro
,,"Ich hatte eine Tasche für meine 2 Transmart Bluetooth Lautsprecher gesucht und diese ""auf Verdacht"" bestellt. Passen optimal und es ist sogar noch genügend Platz für Zubehör. Klare Kaufempfehlung.","Reviewed in Germany on June 5, 2019",BF-SW
,,"We're travelling extensively and needed something to hold all our electronic accessories in an organised way that we could easily access - this is it! Great little bag, good quality and well thought-through design - very practical. Highly recommend.","Reviewed in Australia on September 26, 2019",Flowerpot
,,"Ottima borsetta, la organizzo in base all'esigenza con cavi vari, Hard disk, batterie delle fotocamere e gingilli vari. Insomma abbastanza capiente.. un MUST HAVE per un vero NERD! :)","Reviewed in Italy on October 29, 2019",NilsR
,,"Excelente producto, me encantó, tiene un buen espacio interior pero sin desproporcionado las dimensiones externas. Además esta construido con material de calidad","Reviewed in Mexico on January 28, 2020",Mike
,,Excelente producto y de material de mediana calidad. Cumple con el objetivo para ordenar y mantener tus cables y componentes en un solo lugar.,"Reviewed in Mexico on January 25, 2020",Gabriel Benítez
,,"È un comodo porta tutto, con scomparti suddivisi e comodi elastici ferma oggetti, tacche chiuse con cerniera. Lo utilizzo come porta accessori per il cucito e ho tutto quello che mi serve a portata di mano. Una buona capienza.","Reviewed in Italy on July 14, 2019",Cliente Kindle
,,util para ordenar componentes electronicos de movil y pc,"Reviewed in Spain on January 6, 2020",José Luis González Taboada
,,Perfecto para lo que necesito. Incluso me vendría bien un poco más grande. La volvería a comprar.,"Reviewed in Spain on July 29, 2020",Jorge
,,Cumple con las especificaciones presentadas. Tiene almacenamiento abundante y útil. Lo recomiendo encarecidamente.,"Reviewed in Spain on November 8, 2020",Paulus Macro
,,"J'ai reçu cette sacoche semi-rigide aujourd'hui, elle était assez froissée et tout aplatie à l'ouverture du colis. Cependant, elle a repris de la forme après l'avoir rempli. Combiné à un système de velcro, j'ai pu y ranger et organiser mes câbles qui étaient à l'origine fourrés dans un tiroir. Mais la taille de la sacoche n'est malgré tout pas suffisante pour tout ce que j'ai à ranger. Je pense donc en effet qu'elle est surtout faite pour voyager et préserver temporairement son matériel plutôt que de stocker en  grande quantité. Niveau qualité, la sacoche semble assez solide, mais je trouve  que les coutures assez irrégulières, cela n'a pas l'aire de poser de problème sur sa solidité, mais peut être qu'il pourrait y avoir quelque points faibles dans sa résistance. Je trouve que les fermetures sont assez bien travaillées et ne laisse pas présager de futurs problèmes de fermeture. Question esthétique, le tissu est assez joli mais parait salissant. Et la forme générale de la sacoche qui se voudrait carré finit en réalité avec un aspect assez ""patatoïde"". Mais ces critère sont largement négligeables pour la fonction principale de ce produit. Je vous laisse juger tout ça par mes photos !","Reviewed in France on October 30, 2020",Clément Bernard
,,"Great, fits all our cables and charges and has made travelling just that bit easier.  Great to be able to say to my travel partner (husband) “check the case they are all in there” instead of having to search around for cables and chargers.","Reviewed in Australia on October 18, 2020",Helen Clancy
,,"J'avais besoin d'une petite sacoche et les dimensions données correspondent, seulement l'intérieur est moins logeable que prévu et les bords arrondis n'aident pas. Pourtant j'avais anticipé cela en mesurant chaque objet à y mettre. J'ai peur qu'en forçant les fermetures éclair ne tiennent pas longtemps. Puisque j'ai pas mal de chose à ranger j'en ferai un autre usage.","Reviewed in France on December 20, 2019",Ludovic
,,"Muy práctica, en lo personal yo la ocupo para colocar mi material de trabajo, me funcionó bastante bien cabe todo muy bien","Reviewed in Mexico on February 14, 2020",Joel Sandoval
,,"L'emballage était un peu léger mais pas de dégats à l'arrivée. Le produit correspond bien à la description mais il y a toujours un objet trop volumineux qui ne rentre pas dans cette boite de rangement. Elle semble bien fabriquée et solide et les options de rangement sont multiples. Il faudra maintenant voir à l'usage car je ne l'ai emporté qu'une fois lors d'un voyage. Convient bien pour la câbles, chargeurs et batteries de rechange. Bon achat !","Reviewed in France on December 11, 2019",Mikee
,,"Points forts : - prix - agencement de la sacoche modulable - 2 poches distinctes : d'un coté les clés usb/adaptateurs ; de l'autres les disques dur, chargeurs, etc. - grand volume : on peut y ranger beaucoup de choses - facilement transportable Points faibles : - la matière : le tissu extérieur n'est pas très agréable au toucher. Il pourrait être de meilleur qualité. Toutefois, on s'y habitue et ce n'est pas très dérangent. Par rapport au prix affiché, c'est cohérent.","Reviewed in France on April 25, 2020",JM
